Origin Page,Destination Page,Link Text,Sentence Text,Wikidata Property Label,Direction
Stephen R Carpenter,United States,American,Stephen Russell Carpenter is an American lake ecologist who focuses on lake eutrophication which is the overenrichment of lake ecosystems leading to toxic blooms of microorganisms and fish kills,P27,Forwards
Pahang,Perak,Perak,In 1895 Pahang became a British protectorate along with the states of Perak Selangor and Negeri Sembilan,P47,Forwards
Socialist Left Party Austria,Austria,Austria,The Socialist Left Party German Sozialistische LinksPartei SLP is a Trotskyist political party in Austria,P17,Forwards
City,Abu Dhabi,Abu Dhabi,For example country capitals such as Abu Dhabi Amsterdam Athens Beijing Berlin Bogotá Brasília Buenos Aires Cairo Canberra Copenhagen Helsinki Lisbon London Madrid Mexico City Moscow New Delhi Ottawa Paris Rome San José Santiago Seoul Tokyo Taipei Ulaanbaatar Warsaw Washington DC and Yaoundé reflect the identity and apex of their respective nations,P31,Backwards
Global Environment Outlook,United Nations,UN,The GEO project was initiated in response to the environmental reporting requirements of UN Agenda 21 and to a UNEP Governing Council decision of May 1995 which requested the production of a new comprehensive global state of the environment report,P859,Forwards
Lynx,Iberian lynx,Iberian160lynx,A lynx lɪŋks plural lynx or lynxes is any of the four species the Canada160lynx Iberian160lynx Eurasian160lynx or bobcat within the mediumsized wild cat genus Lynx,P171,Backwards
Tesso Nilo National Park,National park,national park,Tesso Nilo National Park is a national park in Riau Province Sumatra Indonesia,P31,Forwards
Neda Ulaby,United States,American,Neda Ulaby Arabic ندى علبي8206 born c 1970 is an American reporter for National Public Radio covering arts cultural trends and digital media,P27,Forwards
Itombwe Mountains,Democratic Republic of the Congo,Democratic Republic of the Congo,The Itombwe Mountains or Itombwe Massif Plateau are a range of mountains in the South Kivu province of the Democratic Republic of the Congo DRC,P17,Forwards
Norway,Sweden,Sweden,The country shares a long eastern border with Sweden 1619 km or 1006160mi long,P47,Backwards
Leviathan Hobbes book,Thomas Hobbes,Thomas Hobbes,Leviathan or The Matter Forme and Power of a Commonwealth Ecclesiasticall and Civil commonly referred to as Leviathan is a book written by Thomas Hobbes 1588–1679 and published in 1651 revised Latin edition 1668,P800,Backwards
Tunisia,African Union,African Union,It is a member of the United Nations La Francophonie the Arab League the OIC the African Union the NonAligned Movement the International Criminal Court and the Group of 77 among others,P463,Forwards
Family planning,Birth control,contraception,If sexually active family planning may involve the use of contraception and other techniques to control the timing of reproduction,P279,Backwards
Svalbard,Arctic Ocean,Arctic Ocean,Svalbard ˈsvɑːlbɑːr SVAHLbar Urban East Norwegian160ˈsvɑ̂ːɫbɑr32listen previously known as Spitsbergen or Spitzbergen is a Norwegian archipelago in the Arctic Ocean,P706,Forwards
West Africa,Senegal,Senegal,The United Nations defines Western Africa as the 16 countries of Benin Burkina Faso Cape Verde The Gambia Ghana Guinea GuineaBissau Ivory Coast Liberia Mali Mauritania Niger Nigeria Senegal Sierra Leone and Togo,P706,Backwards
Georgina Mace,University College London,University College London,She was Professor of Biodiversity and Ecosystems at University College London and previously Professor of Conservation Science and Director of the Natural Environment Research Council NERC Centre for Population Biology Imperial College London 2006–2012 and Director of Science at the Zoological Society of London 2000–2006,P108,Forwards
Ras Al Khor,Dubai,Dubai,Ras Al Khor Wildlife SanctuaryArabic رَأْس ٱلْخَوْر8206 romanized160Raʾs AlKhawr is a wetland reserve in Dubai the United Arab Emirates renowned for attracting migratory birds in large numbers,P276,Forwards
Kyoto Protocol,European Union,European Union,A second commitment period was agreed to in 2012 to extend the agreement to 2020 known as the Doha Amendment to the Kyoto Protocol in which 37 countries had binding targets Australia the European Union and its then 28 member states now 27 Belarus Iceland Kazakhstan Liechtenstein Norway Switzerland and Ukraine,P6193,Forwards
Yukon,Alaska,Alaska,state of Alaska,P47,Forwards
North Macedonia,Greece,Greece,North Macedonia is a landlocked country bordering with Kosovo91e93 to the northwest Serbia to the north Bulgaria to the east Greece to the south and Albania to the west,P530,Forwards
Patek Philippe SA,Geneva,Geneva,In 2001 it opened the Patek Philippe Museum in Geneva,P159,Forwards
BrongAhafo region,Ghana,Ghana,The BrongAhafo region was a region in southern Ghana,P150,Backwards
Justin Schein,No Impact Man,No Impact Man,He is best known for his work on cinéma vérité films that include America Rebuilds A Year at Ground Zero No Impact Man and Left on Purpose,P57,Backwards
Belgium,World Trade Organization,WTO,Belgium is also a founding member of the Eurozone NATO OECD and WTO and a part of the trilateral Benelux Union and the Schengen Area,P463,Forwards
Kyoto Protocol,Japan,Japan,The Kyoto Protocol was adopted in Kyoto Japan on 11 December 1997 and entered into force on 16 February 2005,P6193,Forwards
The Land Conservancy of British Columbia,Victoria British Columbia,Victoria,It has an office in Victoria,P131,Forwards
Myanmar,India,India,Myanmar is bordered by Bangladesh and India to its northwest China to its northeast Laos and Thailand to its east and southeast and the Andaman Sea and the Bay of Bengal to its south and southwest,P530,Forwards
International Hydrological Programme,UNESCO,UNESCO,The International Hydrological Programme IHP is UNESCO’s international scientific cooperative program in water research water resource management water education and capacity building and the only broadly based science program of the UN system in this area,P859,Forwards
Marojejy National Park,National park,national park,Marojejy National Park məˈroʊdʒɛdʒiː is a national park in the Sava Region of northeastern Madagascar,P31,Forwards
Nereus Program,University of British Columbia,University of British Columbia,The Nereus Program is a global interdisciplinary initiative between the Nippon Foundation and the University of British Columbia that was created to further our knowledge of how best to attain sustainability for our world’s oceans,P159,Forwards
Paul Cattermole,S Club 7,S Club 7,Cattermole was a member of the group S Club 7 but left the group in 2002,P463,Forwards
Indonesia,Jakarta,Jakarta,The countrys capital Jakarta is the worlds secondmost populous urban area,P131,Backwards
Columbia River,British Columbia,British Columbia,The river rises in the Rocky Mountains of British Columbia Canada,P131,Forwards
Belgium,Germany,Germany,It is bordered by the Netherlands to the north Germany to the east Luxembourg to the southeast France to the southwest and the North Sea to the northwest,P47,Backwards
World Business Council for Sustainable Development,Geneva,Geneva,The WBCSD was created in 1995 as a merger of the Business Council for Sustainable Development and the World Industry Council for the Environment and is based at the Maison de la paix in Geneva Switzerland with offices in New York and New Delhi,P131,Forwards
Green sea turtle,Sea turtle,sea turtle,The green sea turtle Chelonia mydas also known as the green turtle black sea turtle or Pacific green turtle is a species of large sea turtle of the family Cheloniidae,P279,Forwards
Bangladesh,India,India,Bangladesh shares land borders with India to the west north and east Myanmar to the southeast and the Bay of Bengal to the south,P530,Backwards
Energy in Botswana,Botswana,Botswana,Botswana has significant reserves of coal estimated at over 200 billion tons,P17,Forwards
Climate change in India,India,India,Climate change in India is having profound effects on India which is  ranked fourth among the list of countries most affected by climate change in the period from 1996 to 2015 India emits about 3 gigatonnes Gt CO2eq of greenhouse gases each year about two and a half tons per person which is half the world average,P921,Forwards
Rwanda,Tanzania,Tanzania,Located a few degrees south of the Equator Rwanda is bordered by Uganda Tanzania Burundi and the Democratic Republic of the Congo,P47,Forwards
FiveYear Plans of Bhutan,Bhutan,Bhutan,The Five Year Plans of Bhutan are a series of national economic development plans created by the government of Bhutan since 1961,P276,Forwards
Barbara Kingsolver,University of Arizona,University of Arizona,Kingsolver earned degrees in biology at DePauw University and the University of Arizona and worked as a freelance writer before she began writing novels,P69,Forwards
Hazelwood Power Station,Australia,Australia,The Hazelwood Power Station is a decommissioned brown coalfuelled thermal power station located in the Latrobe Valley of Victoria Australia,P17,Forwards
Sustainable Development Goals,Sustainable Development Goal 6,Clean Water and Sanitation,The 17 SDGs are 1 No Poverty 2 Zero Hunger 3 Good Health and Wellbeing 4 Quality Education 5 Gender Equality 6 Clean Water and Sanitation 7 Affordable and Clean Energy 8 Decent Work and Economic Growth 9 Industry Innovation and Infrastructure 10 Reducing Inequality 11 Sustainable Cities and Communities 12 Responsible Consumption and Production 13 Climate Action 14 Life Below Water 15 Life On Land 16 Peace Justice and Strong Institutions 17 Partnerships for the Goals,P361,Backwards
Scotland,United Kingdom,United Kingdom,Scotland Scots Scotland Scottish Gaelic Alba ˈal̪ˠapə32listen is a country that is part of the United Kingdom,P150,Backwards
Northern Ireland,Republic of Ireland,Republic of Ireland,Located in the northeast of the island of Ireland Northern Ireland shares a border to the south and west with the Republic of Ireland,P47,Forwards
Human overpopulation,Overpopulation,overpopulation,Human overpopulation or human population overshoot refers to a human population that is too large to be sustained by its environment in the long term,P31,Forwards
Quebec,New Brunswick,New Brunswick,Located in Central Canada the province shares land borders with Ontario to the southwest Newfoundland and Labrador to the northeast New Brunswick to the southeast and a coastal border with Nunavut it also borders the a hrefwikiUSstate titleUS,P47,Backwards
A Short History of Progress,Ronald Wright,Ronald Wright,A Short History of Progress is a nonfiction book and lecture series by Ronald Wright about societal collapse,P50,Forwards
Gord Johns,New Democratic Party,New Democrat,Since 2015 he has served as the New Democrat Member of Parliament for the federal electoral riding of Courtenay—Alberni in the House of Commons of Canada,P102,Forwards
Okanagan Desert,British Columbia,British Columbia,The Okanagan Desert is the common name for a semiarid shrubland located in the southern region of the Okanagan Valley in British Columbia and Washington,P131,Forwards
Tampere Vocational College Tredu,Finland,Finland,Tampere Vocational College Tredu Finnish Tampereen seudun ammattiopisto Tredu is a college based in Tampere Finland,P17,Forwards
Vancouver Convention Centre,Vancouver,Vancouver,The Vancouver Convention Centre formerly known as the Vancouver Convention amp Exhibition Centre or VCEC is a convention centre in Vancouver British Columbia Canada it is one of Canadas largest convention centres,P131,Forwards
Subsoil,Cob material,cob,Claybased subsoil has been the primary source of material for adobe cob rammed earth wattle and daub and other earthen construction methods for millennia,P186,Backwards
Vince McMahon,WWE,WWE,He is currently serving as the chairman and chief executive officer of WWE the largest professional wrestling promotion in the world,P127,Backwards
Judy Wakhungu,Kenya,Kenyan,Judi Wangalwa Wakhungu is a Kenyan politician and diplomat who was appointed by President Uhuru Kenyatta as Ambassador to France on 26 January 2018,P27,Forwards
Seawater,Sea,sea,Seawater or salt water is water from a sea or ocean,P527,Backwards
Netherlands,OECD,OECD,The country is a founding member of the EU Eurozone G10 NATO OECD and WTO as well as a part of the Schengen Area and the trilateral Benelux Union,P463,Forwards
Hungary,European Union,European Union,Hungary joined the European Union in 2004 and has been part of the Schengen Area since 2007,P527,Backwards
United States Botanic Garden,United States,United States,It is the oldest continuallyoperating botanic garden in the United States,P17,Forwards
Rizhao,Shandong,Shandong,Rizhao Chinese58 日照 alternatively romanized as Jihchao is a prefecturelevel city in southeastern Shandong province China,P150,Backwards
2015 Southeast Asian haze,Air pollution,air pollution,The 2015 Southeast Asian haze was an air pollution crisis affecting several countries in Southeast Asia including Brunei Indonesia especially its islands of Sumatra and Borneo Malaysia Singapore southern Thailand Vietnam Cambodia and the Philippines,P1269,Forwards
Ontario,Quebec,Quebec,Located in Central Canada it is Canadas most populous province with 383160percent of the countrys population and is the secondlargest province by total area after Quebec,P47,Backwards
European Commissioner for Budget and Administration,European Union,European Union,The portfolio is primarily responsible for the management of the budget of the European Union and related financial issues except for budgetary discharge which falls under the Admin Commissioner,P1001,Forwards
Journal of Plant Physiology,Elsevier,Elsevier,It is published by Elsevier,P123,Forwards
Nonrenewable resource,Renewable resource,renewable resources,Conversely resources such as timber when harvested sustainably and wind used to power energy conversion systems are considered renewable resources largely because their localized replenishment can occur within time frames meaningful to humans as well,P461,Backwards
Caloocan,Malabon,Malabon,South Caloocan is bordered by Manila Quezon City Malabon Navotas and Valenzuela,P47,Forwards
Kingswood House School,United Kingdom,United Kingdom,Kingswood House School is a preparatory school in Epsom Surrey in the United Kingdom,P17,Forwards
Chiribiquete National Park,Colombia,Colombia,Chiribiquete National Natural Park Spanish Parque Nacional Natural PNN Serranía de Chiribiquete is the largest national park in Colombia and the largest tropical rainforest national park in the world,P17,Forwards
United Nations Foundation,Washington DC,Washington DC,The United Nations Foundation is a charitable organization headquartered in Washington DC that supports the United Nations and its activities,P131,Forwards
Kanchenjunga Conservation Area,Protected area,protected area,Kanchenjunga Conservation Area is a protected area in the Himalayas of eastern Nepal that was established in 1997,P31,Forwards
Sweden,European Union,European Union,This is not however to be confused with migrants national backgrounds which are recorded  Since 3 September 1967  The eu domain is also used as it is shared with other European Union member states,P150,Backwards
Valenzuela Metro Manila,Philippines,Philippines,July 2020citation needed93 officially the City of Valenzuela Tagalog Lungsod ng Valenzuela is a 1st class highly urbanized city in the National Capital Region of the Philippines,P17,Forwards
Sustainable Development Goals,Sustainable Development Goal 1,No Poverty,The 17 SDGs are 1 No Poverty 2 Zero Hunger 3 Good Health and Wellbeing 4 Quality Education 5 Gender Equality 6 Clean Water and Sanitation 7 Affordable and Clean Energy 8 Decent Work and Economic Growth 9 Industry Innovation and Infrastructure 10 Reducing Inequality 11 Sustainable Cities and Communities 12 Responsible Consumption and Production 13 Climate Action 14 Life Below Water 15 Life On Land 16 Peace Justice and Strong Institutions 17 Partnerships for the Goals,P527,Forwards
GNU General Public License,Richard Stallman,Richard Stallman,The licenses were originally written by Richard Stallman founder of the Free Software Foundation FSF for the GNU Project and grant the recipients of a computer program the rights of the Free Software Definition,P50,Forwards
Pacific Ocean,World Ocean,World Ocean,At 165250000 square kilometers 63800000 square miles in the area as defined with a southern Antarctic border this largest division of the World Ocean—and in turn the hydrosphere—covers about 46 of Earths water surface and about 32 of its total surface area making it larger than all of Earths land area combined 148000000  square kilometers,P361,Forwards
Woodland,Forest,forests, Higherdensity areas of trees with a largely closed canopy that provides extensive and nearly continuous shade are often referred to as forests,P1889,Forwards
Estonia,Finland,Finland,It is bordered to the north by the Gulf of Finland across from Finland to the west by the Baltic Sea across from Sweden to the south by Latvia and to the east by Lake Peipus and Russia,P530,Backwards
Jacinda Ardern,New Zealand,New Zealand,Jacinda Kate Laurell Ardern dʒəˈsɪndə ˈɑːrdɜːrn born 26 July 1980 is a New Zealand politician who has served since 2017 as the 40th prime minister of New Zealand and as leader of the Labour Party,P6,Backwards
Metro Manila,San Juan Metro Manila,San Juan,It is composed of 16 cities the city of Manila Quezon City Caloocan Las Piñas Makati Malabon Mandaluyong Marikina Muntinlupa Navotas Parañaque Pasay Pasig San Juan Taguig and Valenzuela as well as the municipality of Pateros,P150,Forwards
Northwest Territories,Saskatchewan,Saskatchewan,The Northwest Territories is bordered by Canadas two other territories Nunavut to the east and Yukon to the west and by the provinces of British Columbia Alberta and Saskatchewan to the south and may touch Manitoba at a quadripoint to the southeast,P807,Backwards
Norway,OECD,OECD,Norway is also a founding member of the United Nations NATO the European Free Trade Association the Council of Europe the Antarctic Treaty and the Nordic Council a member of the European Economic Area the WTO and the OECD and a part of the Schengen Area,P463,Forwards
Bioneers,United States,United States,Plenary Keynote sessions from the national conference are also webcast to Beaming Bioneers satellite conferences held simultaneously in various locations throughout the United States and Canada,P17,Forwards
Myanmar,Bangladesh,Bangladesh,Myanmar is bordered by Bangladesh and India to its northwest China to its northeast Laos and Thailand to its east and southeast and the Andaman Sea and the Bay of Bengal to its south and southwest,P47,Forwards
Sustainable Development Goal 1,Poverty,lowincome,Extreme poverty remains prevalent in lowincome countries particularly those affected by conflict and political upheaval,P921,Forwards
Hattorf am Harz,Germany,Germany,Hattorf am Harz is a municipality in the district of Göttingen in Lower Saxony Germany,P17,Forwards
European Union,Croatia,Croatia,LegislatureSee legislative procedureFormation•160Treaty of Rome 1 January 1958•160Single European Act 1 July 1987•160Treaty of Maastricht 1 November 1993•160Treaty of Lisbon 1 December 2009•160Last polity admitted 1 July 2013 Croatia•160Last polity withdrawn 31 January 2020 United Kingdom,P150,Forwards
Uhuru Kenyatta,Kenya,Kenya,He is the son of Jomo Kenyatta Kenyas first president and his fourth wife Mama Ngina Kenyatta,P35,Backwards
Saskatchewan,Northwest Territories,Northwest Territories,Saskatchewan is bordered on the west by Alberta on the north by the Northwest Territories on the east by Manitoba to the northeast by Nunavut and on the south by the US states of Montana and North Dakota,P47,Forwards
Sherina Munaf,Indonesia,Indonesia,Sinna Sherina Munaf or better known as Sherina Munaf born in Bandung West Java Indonesia on June 11 1990 is an Indonesian actress singer and songwriter of Minangkabau descent,P27,Forwards
SinoSingapore Tianjin Ecocity,China,China,The SinoSingapore Tianjin Ecocity SSTEC simplified Chinese58 中新天津生态城 traditional Chinese58 中新天津生態城 pinyin58 ZhōngXīn Tiānjīn Shēngtài Chéng is the result of a collaborative agreement between the governments of China and Singapore to jointly develop a socially harmonious environmentally friendly and resourceconserving city in China,P17,Forwards
The Theory of the Leisure Class,Thorstein Veblen,Thorstein Veblen,The Theory of the Leisure Class An Economic Study of Institutions 1899 is a book by Thorstein Veblen about how the possession or pursuit of wealth affects human behavior,P800,Backwards
European Union,Czech Republic,Czech Republic,   160Czech Republic,P463,Backwards
Germany,Berlin,Berlin,    Anthem160Deutschlandlied91a93English Song of GermanyShow globeShow map of EuropeLocation of160Germany160dark green–160in Europe160light green amp160dark grey–160in the European Union160light greenCapitaland largest cityBerlin91b9352°31′N 13°23′Exfeff  xfeff52517°N 13383°Exfeff  52517 13383Official languagemwparseroutput noboldfontweightnormaland national languageGerman91c93DemonymsGermanGovernmentFederal parliamentary republic•160President FrankWalter Steinmeier•160Chancellor Angela Merkel•160Vice Chancellor Olaf Scholz,P150,Forwards
Belgium,European Union,European Union,Belgium is one of the six founding countries of the European Union and its capital Brussels hosts the official seats of the European Commission the Council of the European Union and the European Council as well as one of two seats of the European Parliament the other being Strasbourg,P463,Forwards
Iran,Middle East,Middle East,It is the secondlargest country in the Middle East and its capital and largest city is Tehran,P361,Forwards
City,London,London,For example country capitals such as Abu Dhabi Amsterdam Athens Beijing Berlin Bogotá Brasília Buenos Aires Cairo Canberra Copenhagen Helsinki Lisbon London Madrid Mexico City Moscow New Delhi Ottawa Paris Rome San José Santiago Seoul Tokyo Taipei Ulaanbaatar Warsaw Washington DC and Yaoundé reflect the identity and apex of their respective nations,P31,Backwards
Satyendra Pakhale,Industrial design,industrial designer,Satyendra Pakhalé also known as Satyen Pakhalé born 1967 is an industrial designer designer and architect,P101,Forwards
Morris Krok,South Africa,South African,Morris Krok 28 April 1931 – October 2005 was a South African author publisher and health educator,P19,Forwards
Malta,United Nations,United Nations,It has been a member state of the Commonwealth of Nations and the United Nations since independence and joined the European Union in 2004 it became part of the eurozone monetary union in 2008,P463,Forwards
Sahara desert ecoregion,Sahara,Sahara,The Sahara desert as defined by the World Wide Fund for Nature WWF includes the hyperarid center of the Sahara between latitudes 18° N and 30° N,P1425,Backwards
Lise Kingo,Denmark,Denmark,Before her appointment to the position by United Nations Secretary General Ban Ki Moon on 25 June 2015 she was the Executive Vice President Chief of Staff and member of executive management at Novo Nordisk a prominent multinational pharmaceutical company headquartered in her native country of Denmark,P27,Forwards
The Washington Post,Washington DC,Washington DC,The Washington Post also known as the Post and informally WaPo is an American daily newspaper owned by Jeff Bezos and published in Washington DC It is the mostwidely circulated newspaper within the Washington metropolitan area and has a large national audience,P138,Forwards
Our Planet,David Attenborough,David Attenborough,The series is narrated by David Attenborough and produced by Silverback Films led by Alastair Fothergill and Keith Scholey who also created BBC documentary series Planet Earth Frozen Planet and The Blue Planet in collaboration with the conservation charity World Wildlife Fund WWF,P161,Forwards
Philippines,Metro Manila,Metro Manila,  While Manila is designated as the nations capital the seat of government is the National Capital Region commonly known as Metro Manila of which the city of Manila is a part,P150,Forwards
Tharu people,Nepal,Nepal,The Tharu people are an ethnic group indigenous to the Terai in southern Nepal and northern India,P172,Backwards
Henkels leaftailed gecko,Madagascar,Madagascar,The species is endemic to Madagascar,P183,Forwards
Sixth Labour Government of New Zealand,Jacinda Ardern,Jacinda Ardern,It is headed by Labour Party leader and Prime Minister Jacinda Ardern,P6,Forwards
Netherlands,Belgium,Belgium,In Europe the Netherlands consists of twelve provinces bordering Germany to the east Belgium to the south and the North Sea to the northwest with maritime borders in the North Sea with those countries and the United Kingdom,P530,Backwards
Gilbert Rist,Graduate Institute of International and Development Studies,Graduate Institute of International and Development Studies,Gilbert Rist was an honorary professor at the Graduate Institute of International and Development Studies in Geneva,P69,Forwards
Kirsten KappertGonther,Alliance 90The Greens,Alliance 90The Greens,Kirsten KappertGonther born 3 November 1966 is a German psychotherapist and politician of Alliance 90The Greens,P102,Forwards
Verona Arena,Verona,Verona,The Verona Arena Italian Arena di Verona aˈrɛːna di veˈroːna aˈreːna  is a Roman amphitheatre in Piazza Bra in Verona Italy built in the first century,P131,Forwards
