Origin Page,Destination Page,Link Text,Sentence Text,Wikidata Property Label,Direction
National Biodiesel Board,United States,United States,The National Biodiesel Board NBB is an American commercial trade association representing the biodiesel industry as the unifying and coordinating body for research and development in the United States,P17,Forwards
United Nations Volunteers,United Nations Development Programme,United Nations Development Programme,UNV with six regional offices and field units in many countries is administered by the United Nations Development Programme UNDP and reports to the UNDP Executive Board,P749,Forwards
Canada,G20,G20,Canada is part of several major international and intergovernmental institutions or groupings including the United Nations NATO the G7 the Group of Ten the G20 the United States–Mexico–Canada Agreement the Commonwealth of Nations the Organisation internationale de la Francophonie the AsiaPacific Economic Cooperation forum and the Organization of American States,P527,Backwards
Prentice Hall,Pearson Education,Savvas Learning Company,Prentice Hall is an American major educational publisher owned by Savvas Learning Company,P355,Backwards
Liberia,United Nations,United Nations,Internationally Liberia was a founding member of the League of Nations United Nations and the Organisation of African Unity,P112,Backwards
Charter of the United Nations,United Nations,United Nations,The Charter of the United Nations also known as the UN Charter is the foundational treaty of the United Nations an intergovernmental organization,P457,Backwards
Ningaloo Coast,Western Australia,Western Australia,The Ningaloo Coast is a World Heritage Site located in the north west coastal region of Western Australia,P131,Forwards
Togo,Ghana,Ghana,Togo ˈtoʊɡoʊ32listen officially the Togolese Republic French République togolaise is a country in West Africa bordered by Ghana to the west Benin to the east and Burkina Faso to the north,P47,Forwards
Arlington Municipal Airport Oregon,United States,United States,Arlington Municipal Airport FAA LID 1S8 is a public airport located one mile 2160km northeast of the central business district of Arlington in Gilliam County Oregon United States,P17,Forwards
Intergovernmental SciencePolicy Platform on Biodiversity and Ecosystem Services,Intergovernmental Panel on Climate Change,Intergovernmental Panel on Climate Change,It is intended to serve a similar role to the Intergovernmental Panel on Climate Change,P941,Forwards
Caloocan,Quezon City,Quezon City,South Caloocan is bordered by Manila Quezon City Malabon Navotas and Valenzuela,P47,Forwards
Chongming Island,China,China,Chongming formerly known as Chungming is an alluvial island at the mouth of the Yangtze River in eastern China covering 1267 square kilometers 489160sq160mi as of 2010,P17,Forwards
United Nations,World Food Programme,World Food Programme,The UN System includes a multitude of specialized agencies funds and programmes such as the World Bank Group the World Health Organization the World Food Programme UNESCO and UNICEF,P749,Backwards
The Land Conservancy of British Columbia,Victoria British Columbia,Victoria,It has an office in Victoria,P159,Forwards
Graduate Institute of International and Development Studies,Kofi Annan,Kofi Annan,The institution counts one UN secretarygeneral Kofi Annan seven Nobel Prize recipients one Pulitzer Prize winner and numerous ambassadors foreign ministers and heads of state among its alumni and faculty,P69,Backwards
New Mexico,Arizona,Arizona,It is one of the Mountain States of the Southern Rocky Mountains and shares the Four Corners region of the Western US with Utah Colorado and Arizona,P47,Backwards
Czech Republic,European Union,European Union,    Motto160Pravda vítězí160CzechTruth prevailsAnthem160Kde domov můj160160CzechWhere is my home160aLocation of160the160Czech Republic160dark green–160in Europe160green amp160dark grey–160in the European Union160green160 –160 91Legend93Capitaland largest cityPrague50°05′N 14°28′Exfeff  xfeff50083°N 14467°Exfeff  50083 14467Official languageCzechmwparseroutput noboldfontweightnormalOfficially recognized languages ,P527,Backwards
Netherlands,Belgium,Belgium,In Europe the Netherlands consists of twelve provinces bordering Germany to the east Belgium to the south and the North Sea to the northwest with maritime borders in the North Sea with those countries and the United Kingdom,P47,Forwards
Agriculture,Organic farming,Organic,Organic,P279,Backwards
Tanzania,Uganda,Uganda,It borders Uganda to the north Kenya to the northeast Comoro Islands and the Indian Ocean to the east Mozambique and Malawi to the south Zambia to the southwest and Rwanda Burundi and the Democratic Republic of the Congo to the west,P47,Backwards
Chihuahua state,New Mexico,New Mexico,states of New Mexico and Texas,P47,Backwards
Caatinga moistforest enclaves,Brazil,Brazil,It is located in northeastern Brazil,P17,Forwards
Metro Manila,Pasig,Pasig,It is composed of 16 cities the city of Manila Quezon City Caloocan Las Piñas Makati Malabon Mandaluyong Marikina Muntinlupa Navotas Parañaque Pasay Pasig San Juan Taguig and Valenzuela as well as the municipality of Pateros,P131,Backwards
ICVolunteers,Geneva,Geneva,With its headquarters in Geneva Switzerland ICVolunteers has offices and permanent representation in a number of other countries including France South Africa Mali Spain Brazil and Canada,P159,Forwards
NiokoloKoba National Park,Senegal,Senegal,The NiokoloKoba National Park French Parc National du Niokolo Koba PNNK is a World Heritage Site and natural protected area in south eastern Senegal near the GuineaBissau border,P276,Forwards
Sre Pok Wildlife Sanctuary,Cambodia,Cambodia,Sre Pok Wildlife Sanctuary Khmer ដែនជម្រកសត្វព្រៃស្រែពក formerly Mondulkiri Protected Forest is a 372971160ha 144005160sq160mi large wildlife sanctuary in Mondulkiri Province eastern Cambodia established on May 9 2016 according to Subdecree No,P17,Forwards
Atomic Energy Regulatory Board,Mumbai,Mumbai,The headquarters is in Mumbai,P159,Forwards
Shanghai,Yangtze,Yangtze,The city is located on the southern estuary of the Yangtze River with the Huangpu River flowing through it,P131,Backwards
Hazon,New York City,New York City,Hazon Hebrew חָזוֹן8206 91χaˈzon93 is a nonprofit organization based in New York City that seeks to create new vision in the Jewish community through outdoor and environmental education,P159,Forwards
Brazil,Amazon rainforest,vast tropical forest,Its Amazon basin includes a vast tropical forest home to diverse wildlife a variety of ecological systems and extensive natural resources spanning numerous protected habitats,P17,Backwards
Small Island Developing States,Developing country,developing countries,Small Island Developing States SIDS are a group of developing countries that are small island countries which tend to share similar sustainable development challenges,P279,Forwards
Kyoto Protocol,United Nations Framework Convention on Climate Change,United Nations Framework Convention on Climate Change,The Kyoto Protocol was an international treaty which extended the 1992 United Nations Framework Convention on Climate Change UNFCCC that commits state parties to reduce greenhouse gas emissions based on the scientific consensus that part one global warming is occurring and part two that humanmade CO2 emissions are driving it,P361,Forwards
Maternal health in Ethiopia,Health in Ethiopia,Health in Ethiopia,Health in Ethiopia has improved from the last decades to then through the major achievement in areas of health service delivery by making health system accessible affordable and acceptable at different level for the beneficiaries and put different efforts to provide quality health services care,P279,Forwards
Lowcarbon economy,Economy,economy,A lowcarbon economy LCE lowfossilfuel economy LFFE or decarbonised economy is an economy based on lowcarbon power sources that therefore has a minimal output of  greenhouse gas GHG emissions into the atmosphere specifically carbon dioxide,P279,Forwards
Government of India,India,India,The seat of the Government is located in New Delhi the capital of India,P17,Forwards
Cynthia Alexander,Philippines,Philippines,Cynthia Veronica Ayala 1971 is a singersongwriter and multiinstrumentalist originally from the Philippines,P27,Forwards
North Region Brazil,Brazil,Brazil,The North Region of Brazil Portuguese Região Norte do Brasil ʁeʒiˈɐ̃w̃ ˈnɔʁtʃi du bɾaˈziw is the largest Region of Brazil corresponding to 4527 of the national territory,P17,Forwards
Nature,Phenomenon,phenomena,Nature can refer to the phenomena of the physical world and also to life in general,P31,Forwards
Botswana,Namibia,Namibia,It is bordered by South Africa to the south and southeast Namibia to the west and north and Zimbabwe to the northeast,P530,Backwards
Bhutan,Bangladesh,Bangladesh,It has since expanded relations with 55 countries including Bangladesh Israel Kuwait Brazil Japan Thailand and Turkey as well as the European Union,P530,Forwards
Norway,European Union,European Union,Norway maintains close ties with both the European Union and the United States,P47,Backwards
Tunisia,North Africa,North Africa,It is a part of the Maghreb region of North Africa and is bordered by Algeria to the west and southwest Libya to the southeast and the Mediterranean Sea to the north and east covering 163610160km2 63170160sq160mi with a population of 11 million,P527,Backwards
Nature conservation,Conservation movement,conservation movement,Nature conservation is the moral philosophy and conservation movement focused on protecting species from extinction maintaining and restoring habitats enhancing ecosystem services and protecting biological diversity,P460,Forwards
Belgium,Brussels,Brussels,The flags official proportions of 1315 are rarely seen proportions of 23 or similar are more commonThe Brussels region is the de facto capital but the City of Brussels municipality is the de jure capital,P131,Backwards
Bali,Indonesia,Indonesia,Bali ˈbɑːli Balinese ᬩᬮᬶ is a province of Indonesia and the westernmost of the Lesser Sunda Islands,P131,Forwards
Sanda Ojiambo,Kenya,Kenyan,Sanda Ojiambo is a Kenyan administrator who was appointed as executive director of the United Nations Global Compact succeeding Lise Kingo of Denmark effective 17 June 2020,P27,Forwards
Economy of Chongqing,China,China,The economy of Chongqing China has developed rapidly since it was separated from the Sichuan province and became a centrallyadministered municipality in 1997,P17,Forwards
Ethiopia,Somaliland,Somaliland, It shares borders with Eritrea to the north Djibouti and Somaliland to the northeast Somalia to the east Kenya to the south South Sudan to the west and Sudan to the northwest,P47,Backwards
Renewable energy,Wind power,onshore wind,As of 2020 in most countries photovoltaic solar and onshore wind are the cheapest forms of building new electricitygenerating plants,P279,Backwards
Utrecht province,Netherlands,Netherlands,Utrecht Dutch pronunciation32ˈytrɛxt32listen officially the Province of Utrecht Dutch Provincie Utrecht is a province of the Netherlands,P150,Backwards
European Union,Malta,Malta,   160Malta,P463,Backwards
Sweden,Finland,Finland,It borders Norway to the west and north Finland to the east and is connected to Denmark in the southwest by a bridgetunnel across the Öresund Strait,P530,Backwards
Earth,Sun,Sun,Earth is the third planet from the Sun and the only astronomical object known to harbor and support life,P397,Forwards
Central African Republic,Democratic Republic of the Congo,Democratic Republic of the Congo,It is bordered by Chad to the north Sudan to the northeast South Sudan to the southeast the Democratic Republic of the Congo to the south the Republic of the Congo to the southwest and Cameroon to the west,P47,Backwards
Alberta,Northwest Territories,Northwest Territories,Alberta is bordered by British Columbia to the west Saskatchewan to the east the Northwest Territories NWT to the north and the a hrefwikiUSstate titleUS,P47,Backwards
Yeungnam University,South Korea,South Korea,Yeungnam University is a private research university and located in Gyeongsan North Gyeongsang South Korea,P17,Forwards
Journal of Business Logistics,WileyBlackwell,WileyBlackwell,The Journal of Business Logistics is a peerreviewed academic journal published by WileyBlackwell on behalf of the Council of Supply Chain Management Professionals covering research and best practices in logistics and supply chain management,P123,Forwards
Our Planet,David Attenborough,David Attenborough,The series is narrated by David Attenborough and produced by Silverback Films led by Alastair Fothergill and Keith Scholey who also created BBC documentary series Planet Earth Frozen Planet and The Blue Planet in collaboration with the conservation charity World Wildlife Fund WWF,P371,Forwards
New Brunswick,Canada,Canada,New Brunswick French NouveauBrunswick is one of the thirteen provinces and territories of Canada,P131,Forwards
New Brunswick,Nova Scotia,Nova Scotia,In 1784 following the arrival of many loyalists fleeing the American Revolution the colony of New Brunswick was officially created separating it from what is now Nova Scotia,P47,Forwards
MIKTA,Indonesia,Indonesia,MIKTA is an informal middle power partnership between Mexico Indonesia South Korea Turkey and Australia,P138,Forwards
Vipul Goel,India,India,579 Sector 17 Faridabad Haryana IndiaEducationGraduate in CommerceAlma materUniversity of DelhiOccupationPoliticianWebsiteOfficial Website,P27,Forwards
Oceania,New Zealand,New Zealand,Oceania has a diverse mix of economies from the highly developed and globally competitive financial markets of Australia New Caledonia and New Zealand which rank high in quality of life and human development index to the much less developed economies such as Papua New Guinea Indonesian New Guinea Kiribati Vanuatu and Tuvalu while also including mediumsized economies of Pacific islands such as Palau Fiji and Tonga,P30,Backwards
Nepal,India,India,It is mainly situated in the Himalayas but also includes parts of the IndoGangetic Plain bordering Tibet of China to the north and India in the south east and west while it is narrowly separated from Bangladesh by the Siliguri Corridor and from Bhutan by the Indian state of Sikkim,P530,Backwards
Canada,United Kingdom,United Kingdom,LegislatureParliament•160Upper houseSenate•160Lower houseHouse of CommonsIndependence160from the United Kingdom•160Confederation July 1 1867•160Statute of Westminster December 11 1931•160Patriation April 17 1982,P807,Forwards
Colombia,United Nations,United Nations,Colombia is a member of major global and regional organisations including the United Nations the WTO the OECD the OAS the Pacific Alliance the Andean Community and a NATO Global Partner,P463,Forwards
Gifford Pinchot,United States Forest Service,United States Forest Service,Division of Forestry as the 1st head of the United States Forest Service and as the 28th Governor of Pennsylvania,P39,Forwards
New Zealand,United Kingdom,United Kingdom,LegislatureParliamentHouse of RepresentativesStages of independence160from the United Kingdom•160Responsible government 7 May 1856•160Dominion 26 September 1907•160Statute of Westminster adopted 25 November 1947,P530,Forwards
Nicholas GeorgescuRoegen,Degrowth,degrowth movement,In addition the degrowth movement that formed in France and Italy in the early2000s recognises GeorgescuRoegen as the main intellectual figure influencing the movement,P135,Forwards
Shakers,Quakers,Quakers,They were initially known as Shaking Quakers because of their ecstatic behavior during worship services,P1889,Forwards
Stockholm,Sweden,Sweden,It has the most populous urban area in Sweden as well as in Scandinavia,P36,Backwards
Upper Klamath Lake,United States,United States,Upper Klamath Lake sometimes called Klamath Lake Klamath ews lake  is a large shallow freshwater lake east of the Cascade Range in southcentral Oregon in the United States,P205,Forwards
Columbia River,Snake River,Snake River,The river is 1243 miles 2000160km long and its largest tributary is the Snake River,P403,Backwards
Sanusi Lamido Sanusi,Kano,Kano,Muhammadu Sanusi II Ajami محمدوسانوسي Muhammadu Sanusi na biyu born 31 July 1961 commonly known as Sanusi Lamido Sanusi Ajami سانوسي لاميدو سانوسي is a member of the Dabo dynasty who was the emir sarki of the ancient citystate of Kano,P19,Forwards
World Wide Fund for Nature,Earth Hour,Earth Hour,In addition WWF has launched several notable worldwide campaigns including Earth Hour and Debtfornature swap and its current work is organized around these six areas food climate freshwater wildlife forests and oceans,P664,Backwards
Rally of the Ecologists of Senegal,Senegal,Senegal,The Rally of the Ecologists of Senegal Rassemblement des écologistes du Sénégal – Les Verts is a political party in Senegal,P17,Forwards
Vince McMahon,Stephanie McMahon,Stephanie,He married political executive Linda Edwards in 1966 and is the father of businesspeople Stephanie and Shane McMahon and fatherinlaw to Triple H,P40,Forwards
Indian Institute of Forest Management,Ministry of Environment Forest and Climate Change,Ministry of Environment Forest and Climate Change,The Indian Institute of Forest Management IIFM founded 1982 is an autonomous Natural Resource Service training  institute of  Forestry  located in Bhopal Madhya Pradesh India established by the Ministry of Environment Forest and Climate Change Government of India with financial assistance from the  Swedish International Development Cooperation Agency SIDA and course assistance from the Indian Institute of Management Ahmedabad for mid career training of Indian Forest Service cadre and all State Forest Service cadre in India ,P1416,Forwards
Latvia,Euro,Euro,Area •160Total64589160km2 24938160sq160mi32122nd•160Water160209 as of 2015Population•1602020 estimate190767532147th•1602011160census2070371•160Density296km2 767sq160mi32147thGDP160PPP2021160estimate•160Total63539 billion•160Per capita33393GDP160nominal2021160estimate•160Total37720 billion•160Per capita19824Gini160201mediumHDI160201very high160·16037thCurrencyEuro € EURTime zoneUTC2 EET•160Summer160DSTUTC3 EESTDriving siderightCalling code371ISO 3166 codeLVInternet TLDlvc,P17,Backwards
Living Planet Report,World Wide Fund for Nature,World Wide Fund for Nature,The Living Planet Report is  published every 2 years by the World Wide Fund for Nature since 1998,P123,Forwards
Euro,European Union,European Union,The euro symbol € code EUR is the official currency of 19 of the 27 member states of the European Union,P38,Backwards
Environmental Liability Directive 2004,Directive European Union,Directive,The Environmental Liability Directive 200435EC ELD is a European Union Directive on enforcement of claims against occupational activities which damage the environment,P31,Forwards
Greenpeace,Climate change,climate change,Greenpeace states its goal is to ensure the ability of the Earth to nurture life in all its diversity and focuses its campaigning on worldwide issues such as climate change deforestation overfishing commercial whaling genetic engineering and antinuclear issues,P101,Forwards
Massachusetts,United States,United States,statestate in the New England region of the United States,P150,Backwards
Bhutan,Bangladesh,Bangladesh,Nepal and Bangladesh are located in proximity to Bhutan but do not share a land border,P530,Forwards
Richard Stallman,Massachusetts Institute of Technology,MIT,In September 2019 Stallman resigned as president of the FSF and left his visiting scientist role at MIT after making controversial comments about the Jeffrey Epstein sex trafficking scandal,P69,Forwards
Agriculture,Agricultural science,Agricultural science,Agricultural science,P279,Backwards
United Cities and Local Governments,Barcelona,Barcelona,Since founding in 2004 UCLG is headquartered in Barcelona the World Secretariat Metropolis amp UCLG Regions with its regional offices in Brasilia Brussels Istanbul Jakarta Kazan La Paz Ottawa amp Rabat,P159,Forwards
Sustainable Development Goals,Sustainable Development Goal 3,Good Health and Wellbeing,The 17 SDGs are 1 No Poverty 2 Zero Hunger 3 Good Health and Wellbeing 4 Quality Education 5 Gender Equality 6 Clean Water and Sanitation 7 Affordable and Clean Energy 8 Decent Work and Economic Growth 9 Industry Innovation and Infrastructure 10 Reducing Inequality 11 Sustainable Cities and Communities 12 Responsible Consumption and Production 13 Climate Action 14 Life Below Water 15 Life On Land 16 Peace Justice and Strong Institutions 17 Partnerships for the Goals,P527,Forwards
PreColumbian era,Maya civilization,Maya civilization,A few such as the Maya civilization had their own written records,P31,Backwards
Energy descent,Peak oil,peak oil,Energy descent can be understood in relation to peak oil in which case there is a theoretical postpeak oil transitional phase characterized by a descending use of energy,P1269,Forwards
Sustainable Development Goal 15,Biodiversity,biodiversity,Sustainable Development Goal 15 SDG 15 or Global Goal 15 is about Life on land One of the 17 Sustainable Development Goals established by the United Nations in 2015 the official wording is Protect restore and promote sustainable use of terrestrial ecosystems sustainably manage forests combat desertification and halt and reverse land degradation and halt biodiversity loss,P921,Forwards
Tonda Wildlife Management Area,Protected area,protected area,The Tonda Wildlife Management Area is a wetland of international importance and the largest protected area in Papua New Guinea,P31,Forwards
Amazon biome,Biome,biome,The biome contains blackwater and whitewater flooded forest lowland and montane terra firme forest bamboo and palm forest savanna sandy heath and alpine tundra,P31,Forwards
Silviculture,Forestry,forestry,The distinction between forestry and silviculture is that silviculture is applied at the standlevel while forestry is a broader concept,P361,Forwards
Alaska,Pacific Ocean,Pacific Ocean,To the north are the Chukchi and Beaufort seas of the Arctic Ocean while the Pacific Ocean lies to the south and southwest,P206,Forwards
Reforestation,Deforestation,deforestation,Reforestation occasionally Reafforestation is the natural or intentional restocking of existing forests and woodlands forestation that have been depleted usually through deforestation but also after clearcutting,P461,Forwards
Massachusetts,Connecticut,Connecticut,It borders on the Atlantic Ocean to the east Connecticut to the southwest and Rhode Island to the southeast New Hampshire to the northeast Vermont to the northwest and New York to the west,P47,Forwards
Tanzania,Kenya,Kenya,It borders Uganda to the north Kenya to the northeast Comoro Islands and the Indian Ocean to the east Mozambique and Malawi to the south Zambia to the southwest and Rwanda Burundi and the Democratic Republic of the Congo to the west,P530,Backwards
Mole National Park,Ghana,Ghana,Mole National Park is Ghanas largest wildlife refuge,P276,Forwards
Angola,Cuba,Cuba,The country descended into a devastating civil war the same year between the ruling Peoples Movement for the Liberation of Angola MPLA backed by the Soviet Union and Cuba and the insurgent anticommunist National Union for the Total Independence of Angola UNITA supported by the United States and South Africa,P530,Forwards
Sydney,New South Wales,New South Wales,Sydney ˈsɪdni32listen SIDnee Dharug Cadi is the capital city of the state of New South Wales and the most populous city in Australia and Oceania,P131,Forwards
Geography of North Macedonia,North Macedonia,North Macedonia,North Macedonia is a country situated in southeastern Europe with geographic coordinates 41°50′N 22°00′Exfeff  xfeff41833°N 22000°Exfeff  41833 22000 bordering Kosovo and Serbia to the north Bulgaria to the east Greece to the south and Albania to the west,P17,Forwards
Kingston Airport Nevada,United States,United States,Kingston Airport FAA LID N15 is a public airport located two miles 3160km east of the central business district CBD of Kingston in Lander County Nevada United States,P17,Forwards
Kenya,Uhuru Kenyatta,Uhuru Kenyatta,    Motto160Harambee SwahiliLet us all pull togetherAnthem160Ee Mungu Nguvu YetuEnglish O God of all creationShow globeShow map of AfricaCapitaland largest cityNairobi1°16′S 36°48′Exfeff  xfeff1267°S 36800°Exfeff  1267 36800Official160languagesEnglishSwahiliNational languageSwahiliEthnic160groups  20191713 Kikuyu1435 Luhya1337 Kalenjin1065 Luo981 Kamba585 Somalis568 Kisii523 Mijikenda415 Meru1378 OtherReligion  2019855 Christianity—608 Protestantism—206 Catholicism—41 Other Christian109 Islam16 No religion07 Traditional faiths13 OtherDemonymsKenyanGovernmentUnitary presidential constitutional republic•160President Uhuru Kenyatta•160Deputy President William Ruto•160Speaker of the Senate Kenneth Lusaka•160Speaker of the National Assembly Justin Muturi•160Chief Justice Martha Koome•160Attorney General Paul Kihara Kariuki,P27,Backwards
Austria,Europe,Europe,    Anthem160Bundeshymne der Republik Österreich160160GermanEnglish National Anthem of the Republic of AustriaLocation of160Austria160dark green–160in Europe160green amp160dark grey–160in the European Union160green160 –160 91Legend93Capitaland largest cityVienna48°12′N 16°21′Exfeff  xfeff48200°N 16350°Exfeff  48200 16350Official language mwparseroutput noboldfontweightnormaland national languageGermanabRecognised languages,P30,Forwards
