Origin Page,Destination Page,Link Text,Sentence Text,Wikidata Property Label,Direction
Cameroon,Nigeria,Nigeria,It is bordered by Nigeria to the west and north Chad to the northeast the Central African Republic to the east and Equatorial Guinea Gabon and the Republic of the Congo to the south,P47,Forwards
Norway,United Nations,United Nations,Norway is also a founding member of the United Nations NATO the European Free Trade Association the Council of Europe the Antarctic Treaty and the Nordic Council a member of the European Economic Area the WTO and the OECD and a part of the Schengen Area,P112,Backwards
Endangered Wildlife Trust,South Africa,South African,The Endangered Wildlife Trust is a South African environmental organisation for the conservation of threatened species and ecosystems in southern Africa,P17,Forwards
North Africa,Tunisia,Tunisia,The most commonly accepted definition includes Morocco Algeria Tunisia Libya Egypt and Sudan the 6 countries that shape the top North of the African continent,P361,Backwards
Kenya,Tanzania,Tanzania,Kenya is bordered by South Sudan to the northwest Ethiopia to the north Somalia to the east Uganda to the west Tanzania to the south and the Indian Ocean to the southeast,P530,Forwards
United Nations Statistics Division,United Nations Department of Economic and Social Affairs,United Nations Department of Economic and Social Affairs,The United Nations Statistics Division UNSD formerly the United Nations Statistical Office serves under the United Nations Department of Economic and Social Affairs DESA as the central mechanism within the Secretariat of the United Nations to supply the statistical needs and coordinating activities of the global statistical system,P361,Forwards
Poland,European Union,European Union,It has the sixth largest economy in the European Union by nominal GDP and the fifth largest by GDP PPP,P463,Forwards
United States,New York City,New York City,The national capital is Washington DC and the most populous city is New York City,P17,Backwards
Winnie MpanjuShumbusho,World Health Organization,World Health Organization,Winnie MpanjuShumbusho is a Tanzanianborn paediatrician and public health leader who until December 31 2015 served as World Health Organization WHO Assistant Director General for HIVAIDS Tuberculosis Malaria and Neglected Tropical Diseases based in Geneva Switzerland,P108,Forwards
Forest Stewardship Council,Forest management,management,The Forest Stewardship Council FSC is an international nonprofit multistakeholder organization established in 1993 that promotes responsible management of the worlds forests,P452,Forwards
GNU,Richard Stallman,Richard Stallman,Richard Stallman the founder of the project views GNU as a technical means to a social end,P800,Backwards
Madagascar dry deciduous forests,Madagascar,Madagascar,The Madagascar dry deciduous forests  represent a tropical dry forest ecoregion situated in the western and northern part of Madagascar,P17,Forwards
Syngenta,Pesticide,Pesticides,Pesticides,P1056,Forwards
Menai Bay Conservation Area,Protected area,protected area,At 470 square kilometres 180160sq160mi it is Zanzibars largest marine protected area,P31,Forwards
Czech Republic,United States,United States,It ranks 12th in the UN inequalityadjusted human development and 14th in the World Bank Human Capital Index ahead of countries such as the United States the United Kingdom and France,P530,Backwards
World Health Organization,United Nations Economic and Social Council,United Nations Economic and Social Council,World Health OrganizationAbbreviationWHOPronunciationˌdʌbəljuːˌeɪtʃˈoʊ by WHO itself and the governments that work with it huː is an oftenheard spelling pronunciationx20Formation7160April 1948593273 years ago16019480407TypeUnited Nations specialized agencyLegal statusActiveHeadquartersGeneva SwitzerlandHeadTedros AdhanomDirectorGeneralParent organizationUnited Nations Economic and Social CouncilBudget  796 billion 2020–2021Websitewwwwhoint160Medicine32portal160Politics32portal,P749,Forwards
MIKTA,South Korea,South Korea,MIKTA is an informal middle power partnership between Mexico Indonesia South Korea Turkey and Australia,P527,Forwards
Coordinating Ministry for Human Development and Cultural Affairs,Indonesia,Indonesian,Coordinating Ministry for Human Development and Cultural Affairs is an Indonesian coordinating ministry,P17,Forwards
Lousewies van der Laan,Democrats 66,Democrats 66,Louse Wies Sija Anne Lilly Berthe Lousewies van der Laan born 18 February 1966 is a retired Dutch politician of the Democrats 66 D66 party and jurist,P102,Forwards
Laurens Jan Brinkhorst,Democrats 66,Democrats 66,Laurens Jan Brinkhorst born 18 March 1937 is a retired Dutch politician and diplomat of the Democrats 66 D66 party and jurist,P102,Forwards
Roman Empire,Latin,Latin,The Latin language of the Romans evolved into the Romance languages of the medieval and modern world while Medieval Greek became the language of the Eastern Roman Empire,P37,Forwards
AMA Supercross Championship,United States,American,The AMA Supercross Championship is an American motorcycle racing series,P17,Forwards
Agricultural and Forest Meteorology,Meteorology,meteorology,Agricultural and Forest Meteorology is a peerreviewed scientific journal covering research on the relationships between meteorology and the fields of plant animal and soil sciences ecology and biogeochemistry,P921,Forwards
Sweden,Norway,Norway,It borders Norway to the west and north Finland to the east and is connected to Denmark in the southwest by a bridgetunnel across the Öresund Strait,P47,Forwards
China,Macau,Macau,The country is officially divided into 23 provinces91l93 five autonomous regions four directcontrolled municipalities Beijing Tianjin Shanghai and Chongqing and two special administrative regions of Hong Kong and Macau,P361,Backwards
Rockefeller Foundation,New York City,New York City,The Rockefeller Foundation is an American private foundation based at 420 Fifth Avenue New York City,P159,Forwards
Knersvlakte,South Africa,South Africa,The Knersvlakte is a region of hilly terrain covered with quartz gravel in Namaqualand in the northwest corner of the Western Cape Province of South Africa,P17,Forwards
Gambia River,Senegal,Senegal,The Gambia River formerly known as the River Gambra is a major river in West Africa running 1120 kilometres 700160mi from the Fouta Djallon plateau in north Guinea westward through Senegal and The Gambia to the Atlantic Ocean at the city of Banjul,P17,Forwards
Sustainable fishery,Sustainability,Sustainability,Sustainability in fisheries combines theoretical disciplines such as the population dynamics of fisheries with practical strategies such as avoiding overfishing through techniques such as individual fishing quotas curtailing destructive and illegal fishing practices by lobbying for appropriate law and policy setting up protected areas restoring collapsed fisheries incorporating all externalities involved in harvesting marine ecosystems into fishery economics educating stakeholders and the wider public and developing independent certification programs,P1552,Forwards
Government of India,India,India,The seat of the Government is located in New Delhi the capital of India,P1001,Forwards
GreenPalm,Palm oil,palm oil,GreenPalm is a certificatetrading program for sustainably produced palm oil,P452,Forwards
Pete Oxford,Royal Geographical Society,Royal Geographical Society,In 1992 he became a Fellow of the Royal Geographical Society,P463,Forwards
Benxi,Liaoning,Liaoning,Benxi Chinese58 本溪 pinyin58 Běnxī is a prefecturelevel city located in the east of Liaoning province Peoples Republic of China southsoutheast of the provincial capital Shenyang,P150,Backwards
Indonesia,Jakarta,Jakarta,    Motto160Bhinneka Tunggal Ika Old JavaneseEnglish Unity in DiversityNational ideology PancasilaAnthem160Indonesia RayaEnglish Great IndonesiaCapitaland largest cityJakarta6°10′S 106°49′Exfeff  xfeff6167°S 106817°Exfeff  6167 106817Official language mwparseroutput noboldfontweightnormaland national languageIndonesianRegional languagesOver 700 languagesEthnic160groups Over 1300 ethnic groupsReligion  20188670 Islam1072 Christianity174 Hinduism084 OtherDemonymsIndonesianGovernmentUnitary presidential constitutional republic•160President Joko Widodo•160Vice President Maruf Amin•160House Speaker Puan Maharani•160Chief Justice Muhammad Syarifuddin,P1376,Backwards
Wang Jie composer,Shanghai,Shanghai,Wang Jie was born and raised in Shanghai,P19,Forwards
Human ecology,Ecology,ecology,The philosophy and study of human ecology has a diffuse history with advancements in ecology geography sociology psychology anthropology zoology epidemiology public health and home economics among others,P527,Backwards
Nanda Devi,India,India,Nanda Devi is the second highest mountain in India after Kangchenjunga and the highest located entirely within the country,P17,Forwards
Lakshmi Puri,United Nations,United Nations,Lakshmi Puri born 1952 is a former Assistant SecretaryGeneral at the United Nations and the former Deputy Executive Director of UN Women,P108,Forwards
Ecological economics,Environmental economics,environmental economics,By treating the economy as a subsystem of Earths larger ecosystem and by emphasizing the preservation of natural capital the field of ecological economics is differentiated from environmental economics which is the mainstream economic analysis of the environment,P1889,Backwards
Myanmar,Bangladesh,Bangladesh,Myanmar is bordered by Bangladesh and India to its northwest China to its northeast Laos and Thailand to its east and southeast and the Andaman Sea and the Bay of Bengal to its south and southwest,P530,Backwards
Sustainable Development Goal 7,Sustainable Development Goals,Sustainable Development Goals,Sustainable Development Goal 7 SDG 7 or Global Goal 7 is one of 17 Sustainable Development Goals established by the United Nations General Assembly in 2015,P527,Backwards
Estonia,European Union,European Union,It has a population of 13160million and is one of the least populous members of the European Union the Eurozone the OECD the Schengen Area NATO and the United Nations Security Council,P527,Backwards
Sweden,Norway,Norway,It borders Norway to the west and north Finland to the east and is connected to Denmark in the southwest by a bridgetunnel across the Öresund Strait,P530,Forwards
Muntinlupa,Metro Manila,National Capital Region,Muntinlupa officially the City of Muntinlupa Tagalog Lungsod ng Muntinlupa is a 1st class highly urbanized city in the National Capital Region of the Philippines,P131,Forwards
British Columbia,Victoria British Columbia,City of Victoria,The first British settlement in the area was Fort Victoria established in 1843 which gave rise to the City of Victoria at first the capital of the separate Colony of Vancouver Island,P1376,Backwards
Sustainable Development Goal 15,Sustainable Development Goals,Sustainable Development Goals,Sustainable Development Goal 15 SDG 15 or Global Goal 15 is about Life on land One of the 17 Sustainable Development Goals established by the United Nations in 2015 the official wording is Protect restore and promote sustainable use of terrestrial ecosystems sustainably manage forests combat desertification and halt and reverse land degradation and halt biodiversity loss,P361,Forwards
Ocean,Oceanography,oceanographers,The world ocean contains 97 of Earths water and oceanographers have stated that less than 20 of the oceans have been mapped,P2579,Forwards
Cameroon,Nigeria,Nigeria,It is bordered by Nigeria to the west and north Chad to the northeast the Central African Republic to the east and Equatorial Guinea Gabon and the Republic of the Congo to the south,P530,Forwards
Modul University Vienna,Austria,Austria,Modul University Vienna short MU Vienna is a private university established in 2007 in Vienna Austria focusing on social and economic development particularly in the areas of tourism new media information technology sustainability business management and public governance,P17,Forwards
Indonesia,Borneo,Borneo,It consists of over seventeen thousand islands including Sumatra Java Sulawesi and parts of Borneo and New Guinea,P17,Backwards
Philippines,Metro Manila,Metro Manila,Manila is the nations capital while the largest city is Quezon City both lying within the urban area of Metro Manila,P150,Forwards
Latvia,European Union,European Union,    Anthem160Dievs svētī LatvijuGod Bless LatviaLocation of160Latvia160dark green–160in Europe160green amp160dark grey–160in the European Union160green160 –160 91Legend93Capitaland largest cityRiga56°57′N 24°6′Exfeff  xfeff56950°N 24100°Exfeff  56950 24100Official160languagesLatvianaEthnic160groups  2019625 Latvians247 Russians32 Belarusians22 Ukrainians19 Poles11 Lithuanians02 Roma02 Jews36 Others16032UnspecifiedReligion 800 Christianity—343 Lutheranism—251 Catholicism—169 Orthodoxy—37 Other Christian183 No religion17 OthersDemonymsLatvianGovernmentUnitary parliamentary constitutional republic•160President Egils Levits•160Prime Minister Krišjānis Kariņš•160Speaker of the Saeima Ināra Mūrniece,P463,Forwards
University of Papua New Guinea,Port Moresby,Port Moresby,The University of Papua New Guinea UPNG is a university located in Port Moresby capital of Papua New Guinea,P131,Forwards
Peter Scott,Robert Falcon Scott,Robert Falcon Scott,The only child of Antarctic explorer Robert Falcon Scott he took an interest in observing and shooting wildfowl at a young age and later took to their breeding,P22,Forwards
Ocean,Indian Ocean,Indian,A common definition lists five oceans in descending order by area the Pacific Atlantic Indian Southern Antarctic and Arctic Oceans,P31,Backwards
Air conditioning,Heating ventilation and air conditioning,heating ventilation and air conditioning HVAC,Air conditioning is a member of a family of systems and techniques that provide heating ventilation and air conditioning HVAC,P527,Backwards
Roe,Caviar,caviar,Roe from a sturgeon or sometimes other fish such as flathead grey mullet is the raw base product from which caviar is made,P186,Backwards
Northern short grasslands,Saskatchewan,Saskatchewan,The Northern short grasslands includes parts of the Canadian provinces of Alberta and Saskatchewan and the American Great Plains states of Montana North Dakota Wyoming South Dakota and Nebraska,P131,Forwards
Rwanda,African Union,African Union,The country is member of the African Union the United Nations the Commonwealth of Nations COMESA OIF and the East African Community,P361,Forwards
Ocean Conservancy,United States,United States,Ocean Conservancy founded as The Delta Corporation is a nonprofit environmental advocacy group based in Washington DC United States,P17,Forwards
Education,Sustainable Development Goal 4,Sustainable Development Goal 4,Global initiatives aim at achieving the Sustainable Development Goal 4 which promotes quality education for all,P921,Backwards
Agenda 21,United Nations,United Nations,Agenda 21 is a nonbinding action plan of the United Nations with regard to sustainable development,P123,Forwards
Troposphere,Stratosphere,stratosphere,Atop the troposphere is the tropopause which is the border between the troposphere and stratosphere,P155,Backwards
Ghana,Ivory Coast,Ivory Coast,It spans along the Gulf of Guinea and the Atlantic Ocean sharing borders with the Ivory Coast in the west Burkina Faso in the north Togo in the east the Gulf of Guinea and the Atlantic Ocean in the south,P47,Forwards
David Thomas geographer,United Kingdom,UK,He was born in Buckland Hospital Dover Kent UK in 1958,P27,Forwards
Climate change adaptation,Climate change mitigation,climate change mitigation,It is one of the ways to respond to climate change along with climate change mitigation,P1889,Backwards
European Union,Latvia,Latvia,   160Latvia,P150,Forwards
Critical load,Air pollution,air pollution,In the study of air pollution a critical load is defined as a quantitative estimate of an exposure to one or more pollutants below which significant harmful effects on specified sensitive elements of the environment do not occur according to present knowledge,P1269,Forwards
European Union,Poland,Poland,   160Poland,P463,Backwards
University of British Columbia,British Columbia,British Columbia,Established in 1908 UBC is British Columbias oldest university,P131,Forwards
GNU General Public License,Richard Stallman,Richard Stallman,The licenses were originally written by Richard Stallman founder of the Free Software Foundation FSF for the GNU Project and grant the recipients of a computer program the rights of the Free Software Definition,P800,Backwards
Chi Chi giant panda,London Zoo,London Zoo,Chi Chi Chinese58 姬姬 pinyin58 Jī Jī September 1954 in wild in Sichuan China – 22 July 1972 London Zoo was a wellknown female giant panda at London Zoo in England,P551,Forwards
World Health Organization,Tedros Adhanom,Tedros Adhanom,World Health OrganizationAbbreviationWHOPronunciationˌdʌbəljuːˌeɪtʃˈoʊ by WHO itself and the governments that work with it huː is an oftenheard spelling pronunciationx20Formation7160April 1948593273 years ago16019480407TypeUnited Nations specialized agencyLegal statusActiveHeadquartersGeneva SwitzerlandHeadTedros AdhanomDirectorGeneralParent organizationUnited Nations Economic and Social CouncilBudget  796 billion 2020–2021Websitewwwwhoint160Medicine32portal160Politics32portal,P108,Backwards
Myanmar,Southeast Asia,Southeast Asia,ˈmjɑːnmɑːrˌ ˌmjɑːnˈmɑːr91nb 193 other English pronunciations below Burmese မြန်မာ mjəmà or Burma Burmese ဗမာ bəmà officially the Republic of the Union of Myanmar91nb 293 is a country in Southeast Asia,P706,Forwards
Anjajavy Forest,Madagascar,Madagascar, Anjajavy Forest has much in common with other dry deciduous forests rising out of the tsingy limestone formations of western Madagascar,P17,Forwards
University of the South Pacific,Tuvalu,Tuvalu,Established in 1968 the university is organised as an intergovernmental organisation and is owned by the governments of 12 Pacific island countries the Cook Islands Fiji Kiribati Marshall Islands Nauru Niue Samoa Solomon Islands Tokelau Tonga Tuvalu and Vanuatu,P17,Forwards
Rio Conchos,Chihuahua state,Chihuahua,The Río Conchos Conchos River is a large river in the Mexican state of Chihuahua,P131,Forwards
Republic of Ireland,United Kingdom,United Kingdom,The sovereign state shares its only land border with Northern Ireland which is part of the United Kingdom,P530,Forwards
Germany,Czech Republic,Czech Republic,It borders Denmark to the north Poland and the Czech Republic to the east Austria and Switzerland to the south and France Luxembourg Belgium and the Netherlands to the west,P47,Forwards
Saskatchewan,Manitoba,Manitoba,Saskatchewan is bordered on the west by Alberta on the north by the Northwest Territories on the east by Manitoba to the northeast by Nunavut and on the south by the US states of Montana and North Dakota,P47,Forwards
United Kingdom,Scotland,Scotland,The United Kingdom consists of four countries England Scotland Wales and Northern Ireland,P150,Forwards
Tobacco industry in Malawi,Malawi,Malawi,As of 2005 Malawi was the 12th largest producer of tobacco leaves and the 7th largest global supporter of tobacco leaves,P17,Forwards
Oxford University Press,University of Oxford,University of Oxford,Oxford University Press OUP is the university press of University of Oxford,P138,Forwards
Czech Republic,Austria,Austria,It is bordered by Austria to the south Germany to the west Poland to the northeast and Slovakia to the east,P47,Forwards
BBC,BBC World Service,BBC World Service,Since 1 April 2014 it has also funded the BBC World Service launched in 1932 as the BBC Empire Service which broadcasts in 28 languages and provides comprehensive TV radio and online services in Arabic and Persian,P1830,Forwards
China,Shanghai,Shanghai,The country is officially divided into 23 provinces91l93 five autonomous regions four directcontrolled municipalities Beijing Tianjin Shanghai and Chongqing and two special administrative regions of Hong Kong and Macau,P131,Backwards
International nongovernmental organization,Nongovernmental organization,nongovernmental organization,An international nongovernmental organization INGO extends the concept of a nongovernmental organization NGO to an international scope,P279,Forwards
Germany,Czech Republic,Czech Republic,It borders Denmark to the north Poland and the Czech Republic to the east Austria and Switzerland to the south and France Luxembourg Belgium and the Netherlands to the west,P47,Backwards
Ivory Coast,West Africa,West Africa,Ivory Coast also known as Côte dIvoire91a93 officially the Republic of Côte dIvoire is a country located on the south coast of West Africa,P361,Forwards
Mazingira Green Party of Kenya,Kenya,Kenyan,The Mazingira Green Party of Kenya is a Kenyan green party,P17,Forwards
Circular economy,Industrial ecology,industrial ecology,There is also a broad range of similar concepts or schools of thought including cradletocradle laws of ecology looped and performance economy regenerative design industrial ecology biomimicry and the blue economy,P941,Forwards
Jakarta,Indonesia,Indonesia,Jakarta dʒəˈkɑːrtə Indonesian pronunciation160dʒaˈkarta32listen officially the Special Capital Region of Jakarta Indonesian Daerah Khusus Ibukota Jakarta is the capital of Indonesia,P1376,Forwards
Namibia,Angola,Angola,Its western border is the Atlantic Ocean it shares land borders with Zambia and Angola to the north Botswana to the east and South Africa to the south and east,P47,Forwards
Nana AkufoAddo,Ghana,Ghanaian,Nana Addo Dankwa AkufoAddo æˈkʊfoʊ ɑːˈdoʊ32listen aKUUFoh ahDOH born 29 March 1944 is a Ghanaian politician who is the current president of the Republic of Ghana,P27,Forwards
West Coast Environmental Law,Vancouver,Vancouver,West Coast Environmental Law is an environmental law and public advocacy organization based in Vancouver British Columbia Canada,P159,Forwards
County Clare,Republic of Ireland,Ireland,County Clare Irish Contae an Chláir is a county in Ireland in the MidWest Region and the province of Munster bordered on the west by the Atlantic Ocean,P17,Forwards
Uroplatus,Madagascar,Madagascar,Uroplatus is a genus of geckos commonly referred to as leaftail geckos or flattailed geckos which are endemic to Madagascar and its coastal islands such as Nosy Be,P183,Forwards
Anarchist Seeds Beneath the Snow,David Goodway,David Goodway,Anarchist Seeds Beneath the Snow is a 2006 book about anarchism and leftlibertarian thought in Britain written by David Goodway and published by PM Press,P800,Backwards
Friends of the Earth US,Washington DC,Washington DC,Friends of the Earth US is a nongovernmental environmental organization headquartered in Washington DC with an office in the David Brower Center in Berkeley California,P159,Forwards
National Institute for Public Health and the Environment,Netherlands,Dutch,The National Institute for Public Health and the Environment Dutch Rijksinstituut voor Volksgezondheid en Milieu or simply RIVM  is a Dutch research institute that is an independent agency of the Dutch Ministry of Health Welfare and Sport,P17,Forwards
Tom Hodgkinson,Simple living,approach,His philosophy in his published books and articles is of a relaxed approach to life enjoying it as it comes rather than toiling for an imagined better future,P135,Forwards
IJburg,Netherlands,Netherlands,IJburg is a residential neighbourhood under construction in Amsterdam Netherlands,P17,Forwards
Environmental philosophy,Natural environment,natural environment,Environmental philosophy is a branch of philosophy that is concerned with the natural environment and humans place within it,P2578,Forwards
Northern short grasslands,United States,American,The Northern short grasslands includes parts of the Canadian provinces of Alberta and Saskatchewan and the American Great Plains states of Montana North Dakota Wyoming South Dakota and Nebraska,P17,Forwards
S Club 7,Rachel Stevens,Rachel Stevens,S Club 7 were a British pop group from London in 1998 created by former Spice Girls manager Simon Fuller consisting of members Bradley McIntosh Hannah Spearritt Jo OMeara Jon Lee Paul Cattermole Rachel Stevens and Tina Barrett,P361,Backwards
Norfolk Island,Pacific Ocean,Pacific Ocean,Norfolk Island is the main island in a group comprising the Australian external territory of Norfolk Island situated in the Pacific Ocean between Australia and New Zealand approximately 692160km 430160mi south of New Caledonia,P706,Forwards
Climate,Meteorology,meteorological,Some of the meteorological variables that are commonly measured are temperature humidity atmospheric pressure wind and precipitation,P101,Forwards
History of Namibia,Namibia,Namibia,From 1884 Namibia was a German colony German South West Africa,P1269,Forwards
Diocesan College,South Africa,South Africa,The Diocesan College Colloquially known as Bishops as it is more commonly known is a private English medium boarding and day high school for boys situated in the suburb of Rondebosch in Cape Town in the Western Cape province of South Africa,P17,Forwards
Soil,Earth,Earth,Earths body of soil called the pedosphere has four important functions,P138,Backwards
Stratosphere,Troposphere,troposphere,The stratosphere ˈstrætəˌsfɪər toʊ is the second major layer of Earths atmosphere just above the troposphere and below the mesosphere,P156,Backwards
Ontario,Quebec,Quebec,Located in Central Canada it is Canadas most populous province with 383160percent of the countrys population and is the secondlargest province by total area after Quebec,P47,Forwards
