Origin Page,Destination Page,Link Text,Sentence Text,Wikidata Property Label,Direction
Austria,Germany,Germany,It is bordered by Germany to the northwest the Czech Republic to the north Slovakia to the northeast Hungary to the east Slovenia and Italy to the south and Switzerland and Liechtenstein to the west,P530,Backwards
Piney Woods,United States,United States,Southern StatesSouthern United States covering 54400 square miles 141000160km2 of East Texas southern Arkansas western Louisiana and southeastern Oklahoma,P17,Forwards
Mariarosaria Taddeo,University of Oxford,University of Oxford,Mariarosaria Taddeo is a senior research fellow at the Oxford Internet Institute part of the University of Oxford and deputy director of the Digital Ethics Lab,P108,Forwards
Colombia,Colombian peso,Colombian peso,Area •160Total1141748160km2 440831160sq160mi3225th•160Water16021 as of 2015Population•1602020 estimate 503724243228th•160Density4223km2 1094sq160mi32173rdGDP160PPP2020160estimate•160Total827662160billion3231st•160Per capita16264GDP160nominal2020160estimate•160Total343177160billion3238th•160Per capita6744Gini1602018160504highHDI160201high160·16083rdCurrencyColombian peso COPTime zoneUTC−5b COTDate formatdd−mm−yyyy CEDriving siderightCalling code57ISO 3166 codeCOInternet TLDco,P17,Backwards
Myanmar,United Nations,United Nations,During this time the United Nations and several other organisations have reported consistent and systematic human rights violations in the country,P463,Forwards
Sustainable Development Goals and Ghana,Ghana,Ghana,Ghana is a country in the Western part of Africa located on the coast of the Gulf of Guinea,P17,Forwards
Myanmar,China,China,Myanmar is bordered by Bangladesh and India to its northwest China to its northeast Laos and Thailand to its east and southeast and the Andaman Sea and the Bay of Bengal to its south and southwest,P530,Backwards
Rachel Carson,Silent Spring,Silent Spring,Rachel Louise Carson May 27 1907160– April 14 1964 was an American marine biologist author and conservationist whose influential book Silent Spring 1962 and other writings are credited with advancing the global environmental movement,P800,Forwards
Macharia Kamau,Kenya,Kenya,Macharia Kamau born 3 March 1958 is Kenyas Principal Secretary to the Ministry of Foreign Affairs,P27,Forwards
City,Amsterdam,Amsterdam,For example country capitals such as Abu Dhabi Amsterdam Athens Beijing Berlin Bogotá Brasília Buenos Aires Cairo Canberra Copenhagen Helsinki Lisbon London Madrid Mexico City Moscow New Delhi Ottawa Paris Rome San José Santiago Seoul Tokyo Taipei Ulaanbaatar Warsaw Washington DC and Yaoundé reflect the identity and apex of their respective nations,P31,Backwards
University College London,London,London,University College London which operates as UCL is a public research university located in London United Kingdom and a member institution of the federal University of London,P276,Forwards
Wildlife of Tanzania,Tanzania,Tanzania,Tanzania contains some 20 percent of the species of Africa’s large mammal population found across its reserves conservation areas marine parks and 17 national parks spread over an area of more than 42000 square kilometres 16000160sq160mi and forming approximately 38 percent of the countrys territory,P17,Forwards
Monarch Butterfly Biosphere Reserve,World Heritage Site,World Heritage Site,The Monarch Butterfly Biosphere Reserve Spanish Reserva de Biosfera de la Mariposa Monarca is a World Heritage Site containing most of the overwintering sites of the eastern population of the monarch butterfly,P1435,Forwards
Rwanda,African Union,African Union,The country is member of the African Union the United Nations the Commonwealth of Nations COMESA OIF and the East African Community,P463,Forwards
Earth Policy Institute,Washington DC,Washington DC,Earth Policy Institute was an independent nonprofit environmental organization based in Washington DC in the United States,P131,Forwards
Mathis Wackernagel,University of British Columbia,University of British Columbia,in community and regional planning at the University of British Columbia in Vancouver Canada in 1994,P69,Forwards
Wallonia,Belgium,Belgium,Wallonia wɒˈloʊniə French Wallonie walɔni German Wallonien vaˈloːni̯ən32listen or Wallonie valoˈniː Dutch Wallonië ʋɑˈloːnijə32listen Walloon Region French Région wallonne German Wallonische Region Dutch Waals gewest in the Belgian Constitution is one of the three Regions of Belgium—alongside Flanders and Brussels,P150,Backwards
Paris,UNESCO,UNESCO,The historical district along the Seine in the city centre is classified as a UNESCO World Heritage Site popular landmarks there included the Cathedral of Notre Dame de Paris on the Île de la Cité now closed for renovation after the 15 April 2019 fire,P159,Backwards
Montgomery County Maryland,Washington DC,Washington DC,state of Maryland located adjacent to Washington DC As of the 2010 census the countys population was 971777 increasing by 81 to an estimated 1050688 in 2019,P47,Forwards
Anemia,Malaria,malaria,Causes of increased breakdown include genetic conditions such as sickle cell anemia infections such as malaria and certain autoimmune diseases,P780,Backwards
Nooksack Salmon Enhancement Association,United States,United States,Nooksack Salmon Enhancement Association NSEA was formed in 1990 as a nonprofit organization with an overall goal of seeing an increase in returning natural spawning salmon to the over 1600160km of rivers and streams in Whatcom County Washington in the United States,P17,Forwards
San Juan Metro Manila,Philippines,Philippines,San Juan officially the City of San Juan Tagalog Lungsod ng San Juan is a 1st class highly urbanized city in the National Capital Region of the Philippines,P17,Forwards
Philippines,Taiwan,Taiwan,The Philippines is bounded by the South China Sea to the west the Philippine Sea to the east and the Celebes Sea to the southwest and shares maritime borders with Taiwan to the north Japan to the northeast Palau to the east and southeast Indonesia to the south Malaysia and Brunei to the southwest Vietnam to the west and China to the northwest,P47,Forwards
Netherlands,Caribbean Netherlands,special municipalities,In the Caribbean it consists of three special municipalities the islands of Bonaire Sint Eustatius and Saba,P131,Backwards
New Zealand,United Nations,United Nations,New Zealand is a member of the United Nations Commonwealth of Nations ANZUS Organisation for Economic Cooperation and Development ASEAN Plus Six AsiaPacific Economic Cooperation the Pacific Community and the Pacific Islands Forum,P463,Forwards
Northumberland Wildlife Trust,United Kingdom,UK,Northumberland Wildlife Trust was established in 1971 following a split from the Northumberland amp Durham Trust established 1962 to help conserve and protect the wildlife of Northumberland Newcastle upon Tyne and North Tyneside in the UK,P17,Forwards
Ethiopian xeric grasslands and shrublands,Ecoregion,ecoregion,The Ethiopian xeric grasslands and shrublands ecoregion is a semidesert strip on or near the Red Sea and the Gulf of Aden coasts in Eritrea Ethiopia Djibouti and Somaliland,P31,Forwards
Czech Republic,Poland,Poland,It is bordered by Austria to the south Germany to the west Poland to the northeast and Slovakia to the east,P530,Forwards
Elsevier,Current Opinion Elsevier,Current Opinion, Its products include journals such as The Lancet and Cell the ScienceDirect collection of electronic journals the Trends and Current Opinion series of journals the online citation database Scopus the SciVal tool for measuring research performance the ClinicalKey search engine for clinicians and the ClinicalPath evidencebased cancer care service,P355,Forwards
Namibia,United Nations,United Nations,Namibia is a member state of the United Nations UN the Southern African Development Community SADC the African Union AU and the Commonwealth of Nations,P463,Forwards
Caribbean Netherlands,Netherlands,Netherlands,The Caribbean Netherlands Dutch Caribisch Nederland pronounced32kaːˌribis ˈneːdərlɑnt are the three special municipalities of the Netherlands that are located in the Caribbean Sea,P17,Forwards
Shanghai,China,Peoples Republic of China,Shanghai ʃæŋˈhaɪ Chinese58 上海 Shanghainese pronunciation zɑ̃̀hɛ́ 32listen Standard Mandarin pronunciation ʂa770ŋxa768i32listen is one of the four directadministered municipalities of the Peoples Republic of China governed by the State Council,P131,Forwards
Namibia,South Africa,South Africa,LegislatureParliament•160Upper houseNational Council•160Lower houseNational AssemblyIndependence from South Africa•160Constitution 9 February 1990•160Independence 21 March 1990,P530,Backwards
Loja Ecuador,Loja Province,Loja Province,Loja Spanish pronunciation160ˈloxa formerly Loxa  and fully City of the Immaculate Conception of Loja Spanish Ciudad de la Inmaculada Concepción de Loja is the capital of Ecuadors Loja Province,P36,Backwards
Norway,European Economic Area,European Economic Area,Norway is also a founding member of the United Nations NATO the European Free Trade Association the Council of Europe the Antarctic Treaty and the Nordic Council a member of the European Economic Area the WTO and the OECD and a part of the Schengen Area,P463,Forwards
Sustainability,Biosphere,biosphere,In the 21st century it refers generally to the capacity for Earths biosphere and human civilization to coexist,P1552,Backwards
The Burren,County Clare,County Clare,The Burren ˈbʌrən Irish Boireann meaning great rock is a region of environmental interest primarily located in northwestern County Clare Ireland dominated by glaciated karst or sometimes glaciokarst landscape,P7959,Forwards
Angola,Namibia,Namibia,It is the secondlargest lusophone Portuguesespeaking country in both total area and population behind Brazil and it is the seventhlargest country in Africa bordered by Namibia to the south the Democratic Republic of the Congo to the north Zambia to the east and the Atlantic Ocean to the west,P47,Forwards
Upper Canada College,Toronto,Toronto,Upper Canada College UCC is an independent school for boys between Senior Kindergarten and Grade Twelve in Toronto Ontario operating under the International Baccalaureate program,P131,Forwards
Valenzuela Metro Manila,Malabon,Malabon,A landlocked chartered city located on the island of Luzon it is bordered by the province of Bulacan and cities of Caloocan Malabon and Quezon City,P47,Backwards
Loja Ecuador,Loja Province,Loja Province,Loja Spanish pronunciation160ˈloxa formerly Loxa  and fully City of the Immaculate Conception of Loja Spanish Ciudad de la Inmaculada Concepción de Loja is the capital of Ecuadors Loja Province,P1376,Forwards
Klaus Schwab,World Economic Forum,World Economic Forum,Klaus Martin Schwab German pronunciation32klaʊs ˈmaʁtiːn ʃvaːp born 30 March 1938 is a German engineer and economist best known as the founder and executive chairman of the World Economic Forum,P1037,Backwards
Rolf Disch,Freiburg im Breisgau,Freiburg im Breisgau,Born in Freiburg im Breisgau Germany Disch has dedicated particular focus to regional renewable and sustainable energy,P19,Forwards
JingJinJi,China,Peoples Republic of China,The Jingjinji Metropolitan Region or JingJinJi JJJ91a93 also known as BeijingTianjinHebei BJTJHB and as the Capital Economic Zone is the National Capital Region of the Peoples Republic of China,P17,Forwards
Canada,Toronto,Toronto,Canadas capital is Ottawa and its three largest metropolitan areas are Toronto Montreal and Vancouver,P17,Backwards
Marojejy National Park,Madagascar,Madagascar,Marojejy National Park məˈroʊdʒɛdʒiː is a national park in the Sava Region of northeastern Madagascar,P17,Forwards
Uddhav Thackeray,India,India,Personal detailsBornUddhav Bal Thackeray 19600727 27 July 1960 age16060Bombay Maharashtra India presentday MumbaiPolitical partyShiv SenaSpousesRashmi ThackerayChildrenAditya ThackerayTejas ThackerayFatherBal ThackerayRelativesSee Thackeray FamilyResidenceVarsha Bungalow South Mumbai Mumbai Maharashtra IndiaAlma matera hrefwikiSirJJInstituteofAppliedArt titleSir JJ,P27,Forwards
Tunisia,European Union,European Union,Tunisia also has an association agreement with the European Union and has also attained the status of major nonNATO ally of the United States,P530,Backwards
Functional zoning,Mixeduse development,mixeduse,Functional zoning tends to create or increase car dependency while mixeduse zoning tends to enable walking making it more sustainable,P361,Backwards
Cutthroat trout,Oncorhynchus,Oncorhynchus,As a member of the genus Oncorhynchus it is one of the Pacific trout a group that includes the widely distributed rainbow trout,P171,Forwards
Urban design,Urban planning,planning,Urban design is the process of designing and shaping the physical features of cities towns and villages and planning for the provision of municipal services to residents and visitors,P1382,Backwards
Jonathan Chapman academic,Carnegie Mellon University,Carnegie Mellon University,Jonathan Chapman born 1974 is Professor and Director of Doctoral Studies in the School of Design at Carnegie Mellon University USA,P108,Forwards
2011 Team Sky season,Ineos Grenadiers,Team Sky,The 2011 season for the Team Sky cycling team began in January at the Bay Classic Series and ended in October at the Noosa Grand Prix,P5138,Forwards
Shea Yeleen,Nonprofit organization,nonprofit,Shea Yeleen is a social enterprise that includes a 501c3 nonprofit and a commercial entity that sells highquality unrefined shea butter products The mission of the organization is to promote sustainable economic development in rural subSaharan Africa empower and train womenowned shea butter cooperatives and educate consumers in the US,P31,Forwards
Norway,Europe,Europe,Royal anthem160KongesangenKings SongShow globeShow map of EuropeLocation of160the Kingdom of160Norway160greenin Europe160green and dark greyLocation of the Kingdom of Norway and its integral overseas territories and dependencies Svalbard Jan Mayen Bouvet Island Peter I Island and Queen Maud LandCapitaland largest cityOslo59°56′N 10°41′Exfeff  xfeff59933°N 10683°Exfeff  59933 10683Official160languages,P361,Forwards
International Rice Research Institute,Philippines,Philippines,The International Rice Research Institute IRRI is an international agricultural research and training organization with its headquarters in Los Baños Laguna in the Philippines and offices in seventeen countries,P17,Forwards
Health in Bangladesh,Bangladesh,Bangladesh,Health levels remain relatively low in Bangladesh although they have improved recently as poverty 31 at 2010 levels have decreased,P17,Forwards
Climate change adaptation,Climate change mitigation,climate change mitigation,It is one of the ways to respond to climate change along with climate change mitigation,P1889,Forwards
New Zealand,Niue,Niue,The Realm of New Zealand also includes Tokelau a dependent territory the Cook Islands and Niue selfgoverning states in free association with New Zealand and the Ross Dependency which is New Zealands territorial claim in Antarctica,P530,Forwards
Ivory Coast,West Africa,West Africa,Ivory Coast also known as Côte dIvoire91a93 officially the Republic of Côte dIvoire is a country located on the south coast of West Africa,P527,Backwards
Logging,Illegal logging,Illegal logging,Illegal logging refers to the harvesting transportation purchase or sale of timber in violation of laws,P279,Backwards
London,United Kingdom,United Kingdom,London is the capital and largest city of England and the United Kingdom,P1376,Forwards
M S Swaminathan,India,India,Swaminathan has been called the Father of Green Revolution in India for his role in introducing and further developing highyielding varieties of wheat in India,P27,Forwards
China,G20,G20,The country is a permanent member of the United Nations Security Council and a founding member of several multilateral and regional cooperation organizations such as the Asian Infrastructure Investment Bank the Silk Road Fund the New Development Bank the Shanghai Cooperation Organization and the Regional Comprehensive Economic Partnership and is a member of the BRICS the G85 the G20 the APEC and the East Asia Summit,P527,Backwards
Bhutan,World Health Organization,World Health Organization,Bhutan is also a member of the Climate Vulnerable Forum the NonAligned Movement BIMSTEC the IMF the World Bank UNESCO and the World Health Organization WHO,P463,Forwards
Ladeuzeplein,Belgium,Belgian,In 1783 the monastery was abolished and the city of Leuven bought the estate from the Belgian authorities who had inherited it in order to establish a market dedicated to the sale of wood,P17,Forwards
Atmosphere of Earth,Troposphere,troposphere,Air composition temperature and atmospheric pressure vary with altitude and air suitable for use in photosynthesis by terrestrial plants and breathing of terrestrial animals is found only in Earths troposphere and in artificial atmospheres,P361,Backwards
Gujarat,Maharashtra,Maharashtra,Gujarat is bordered by Rajasthan to the northeast Dadra and Nagar Haveli and Daman and Diu to the south Maharashtra to the southeast Madhya Pradesh to the east and the Arabian Sea and the Pakistani province of Sindh to the west,P47,Forwards
Tamil Nadu,Kerala,Kerala,It is bounded by the Eastern Ghats on the north by the Nilgiri Mountains the Meghamalai Hills and Kerala on the west by the Bay of Bengal in the east by the Gulf of Mannar and the Palk Strait on the southeast and by the Indian Ocean on the south,P47,Backwards
Southeast Asia,Philippines,Philippines,Maritime Southeast Asia also known as the Malay Archipelago and historically as Nusantara comprising the Andaman and Nicobar Islands India Brunei East Malaysia East Timor Indonesia the Philippines and Singapore,P527,Forwards
Classical architecture,New Classical architecture,New Classical architecture,For contemporary buildings following authentic classical principles the term New Classical architecture is sometimes used,P279,Backwards
Aurelio Peccei,Club of Rome,Club of Rome,Aurelio Peccei Italian pronunciation160auˈrɛːljo petˈtʃɛi 4 July 1908 in Turin Piedmont – 14 March 1984 was an Italian industrialist and philanthropist best known as cofounder with Alexander King and first president of the Club of Rome an organisation which attracted considerable public attention in 1972 with its report The Limits to Growth,P3342,Backwards
Sustainable Development Goals,Sustainable Development Goal 17,Partnerships for the Goals,The 17 SDGs are 1 No Poverty 2 Zero Hunger 3 Good Health and Wellbeing 4 Quality Education 5 Gender Equality 6 Clean Water and Sanitation 7 Affordable and Clean Energy 8 Decent Work and Economic Growth 9 Industry Innovation and Infrastructure 10 Reducing Inequality 11 Sustainable Cities and Communities 12 Responsible Consumption and Production 13 Climate Action 14 Life Below Water 15 Life On Land 16 Peace Justice and Strong Institutions 17 Partnerships for the Goals,P527,Forwards
Bhutan,Wildlife of Bhutan,wildlife of Bhutan,The wildlife of Bhutan is notable for its diversity including the Himalayan takin,P276,Backwards
Cuba,United States,US,It is east of the Yucatán Peninsula Mexico south of both the US state of Florida and the Bahamas west of Hispaniola and north of both Jamaica and the Cayman Islands,P47,Forwards
COVID19,COVID19 pandemic,ongoing pandemic,The disease has since spread worldwide leading to an ongoing pandemic,P1889,Backwards
Bioversity International,Maccarese,Maccarese,Its headquarters are in Romes Maccarese borough Italy with regional offices located in Central and South America West and Central Africa East and Southern Africa Central and South Asia and Southeast Asia,P159,Forwards
Malabon,Caloocan,,Malabon is part of the subregion of Metro Manila informally called CAMANAVA which consists of CAloocan MAlabon NAvotas and VAlenzuela cities,P47,Backwards
Mauritania,Atlantic Ocean,Atlantic Ocean,Mauritania is bordered by the Atlantic Ocean to the west Western Sahara to the north and northwest Algeria to the northeast Mali to the east and southeast and Senegal to the southwest,P205,Backwards
Togiak Wilderness,Alaska,Alaska,Togiak Wilderness is a federally designated wilderness area in the Dillingham and Bethel Census Areas in the southwestern part of the US state of Alaska,P131,Forwards
Sorption,Adsorption,Adsorption,Adsorption – the physical adherence or bonding of ions and molecules onto the surface of another phase eg reagents adsorbed to a solid catalyst surface,P31,Backwards
Brazil,Deforestation in Brazil,deforestation,This unique environmental heritage makes Brazil one of the seventeen megadiverse countries and is the subject of significant global interest as environmental degradation through processes like deforestation has direct impacts on global issues like climate change and biodiversity loss,P17,Backwards
India,Myanmar,Myanmar,In the Indian Ocean India is in the vicinity of Sri Lanka and the Maldives its Andaman and Nicobar Islands share a maritime border with Thailand Myanmar and Indonesia,P530,Backwards
Climate change in China,China,China,China is the largest source of carbon dioxide emissions through an energy infrastructure heavily focused on fossil fuels and coal,P17,Forwards
Austria,Hungary,Hungary,It is bordered by Germany to the northwest the Czech Republic to the north Slovakia to the northeast Hungary to the east Slovenia and Italy to the south and Switzerland and Liechtenstein to the west,P530,Forwards
Uddhav Thackeray,Tejas Thackeray,Tejas Thackeray,Personal detailsBornUddhav Bal Thackeray 19600727 27 July 1960 age16060Bombay Maharashtra India presentday MumbaiPolitical partyShiv SenaSpousesRashmi ThackerayChildrenAditya ThackerayTejas ThackerayFatherBal ThackerayRelativesSee Thackeray FamilyResidenceVarsha Bungalow South Mumbai Mumbai Maharashtra IndiaAlma matera hrefwikiSirJJInstituteofAppliedArt titleSir JJ,P40,Forwards
Sustainable Development Goals,Sustainable Development Goal 16,Peace Justice and Strong Institutions,The 17 SDGs are 1 No Poverty 2 Zero Hunger 3 Good Health and Wellbeing 4 Quality Education 5 Gender Equality 6 Clean Water and Sanitation 7 Affordable and Clean Energy 8 Decent Work and Economic Growth 9 Industry Innovation and Infrastructure 10 Reducing Inequality 11 Sustainable Cities and Communities 12 Responsible Consumption and Production 13 Climate Action 14 Life Below Water 15 Life On Land 16 Peace Justice and Strong Institutions 17 Partnerships for the Goals,P361,Backwards
Bosnia and Herzegovina,United Nations,UN,It is a member of the UN Organization for Security and Cooperation in Europe Council of Europe PfP Central European Free Trade Agreement and a founding member of the Union for the Mediterranean upon its establishment in July 2008,P463,Forwards
Australian Council for International Development,Australia,Australian,The Australian Council For International Development ACFID is an independent national association of Australian nongovernment organisations NGOs working in the field of international aid and development,P17,Forwards
New Zealand,Australia,Australia,New Zealand is about 2000 kilometres 1200160mi east of Australia across the Tasman Sea and 1000 kilometres 600160mi south of the islands of New Caledonia Fiji and Tonga,P530,Backwards
Greenpeace USA,Greenpeace,Greenpeace,Greenpeace USA is the United States affiliate of Greenpeace an international environmental nonprofit organization,P463,Forwards
Scotland,England,England,Covering the northern third of the island of Great Britain mainland Scotland has a 96mile 154160km border with England to the southeast and is otherwise surrounded by the Atlantic Ocean to the north and west the North Sea to the northeast and the Irish Sea to the south,P47,Backwards
Democratic Republic of the Congo,Belgium,Belgium,LegislatureParliament•160Upper houseSenate•160Lower houseNational AssemblyFormation•160Colonised 17 November 1879•160Congo Free State 1 July 1885•160Belgian Congo 15 November 1908•160Independence from Belgium 30 June 1960•160Admitted to the United Nations 20 September 1960•160Renamed Democratic Republic of Congo 1 August 1964•160Republic of Zaire 29 October 1971•160First Congo War 17 May 1997•160Current constitution 18 February 2006,P530,Forwards
National and Kapodistrian University of Athens,Athens,Athens,The National and Kapodistrian University of Athens NKUA Greek Εθνικό και Καποδιστριακό Πανεπιστήμιο Αθηνών Ethnikó ke Kapodistriakó Panepistímio Athinón usually referred to simply as the University of Athens UoA is a public university in Athens Greece,P740,Forwards
Thomas Hobbes,Leviathan Hobbes book,Leviathan,Hobbes is best known for his 1651 book Leviathan in which he expounds an influential formulation of social contract theory,P50,Backwards
West Africa,Sierra Leone,Sierra Leone,The United Nations defines Western Africa as the 16 countries of Benin Burkina Faso Cape Verde The Gambia Ghana Guinea GuineaBissau Ivory Coast Liberia Mali Mauritania Niger Nigeria Senegal Sierra Leone and Togo,P527,Forwards
Cimahi,Indonesia,Indonesia,Cimahi Indonesian pronunciation160tʃimahi is a city located immediately west of the larger city of Bandung in West Java Province Indonesia and within the Bandung Metropolitan Area,P17,Forwards
WWE Network,WWE,WWE,WWE Network is an American subscription video ondemand overthetop streaming service and digital television network owned by WWE,P1830,Backwards
Belinda Wright conservationist,India,India,Belinda Anne Irene Wright OBE born 1953 is a prominent wild life photographer and wildlife conservationist in India,P27,Forwards
